{"$schema":"./.executionkit/runtime/kit/schemas/seo-contract.schema.json","schemaVersion":"1.0.0","applicability":"ENABLED","applicabilityRationale":"Bunova will own an Arabic/English public commercial acquisition website; authenticated operational applications remain private and non-indexable.","profile":"STANDARD","modes":["technical","content","international"],"publicWeb":{"baseUrls":[],"rendering":"server","defaultLocale":"ar","locales":["ar","en"]},"surfaceFamilies":[{"id":"SEO-SURFACE-COMMERCIAL_CORE","routePattern":"/{locale?}/{product|features|capabilities|pricing|signup|trial}","surfaceType":"commercial acquisition","primaryIntent":"Explain Bunova and convert qualified café operators into leads, trials or signups.","secondaryIntents":["compare plan/capability fit","understand supported café archetypes"],"entities":["Bunova"],"topics":["cafe management software","cafe POS","gaming cafe management","cafe Wi-Fi management"],"indexPolicy":"INDEX","canonicalPolicy":"SELF","requiredValue":["distinct page intent","Arabic and English visible value","current plan/capability truth","clear conversion path"],"requiredInternalLinks":["pricing","capabilities","signup-or-contact"],"emptyPolicy":"404","localePolicy":"Arabic default with explicit English alternate; reciprocal locale linkage required when both versions exist.","programmatic":false,"coverageThreshold":100,"verificationSamples":["Arabic home/product page","Arabic pricing page","English product page","English pricing page"]},{"id":"SEO-SURFACE-SUPPORT_LEGAL","routePattern":"/{locale?}/{help|privacy|terms|contact}","surfaceType":"support/legal public information","primaryIntent":"Provide trustworthy public support, legal, privacy and contact information.","secondaryIntents":["reduce acquisition uncertainty"],"entities":["Bunova"],"topics":["support","privacy","terms","contact"],"indexPolicy":"CONDITIONAL","canonicalPolicy":"SELF","requiredValue":["real published policy/help content","current ownership/contact information"],"requiredInternalLinks":["commercial-core"],"emptyPolicy":"NOINDEX","localePolicy":"Index only real localized pages with equivalent user value.","programmatic":false,"coverageThreshold":100,"verificationSamples":["privacy page","contact/help page"]}],"structuredDataRegistry":{},"programmaticPolicy":{"defaultIndexEligibility":"PROVEN_ONLY","requireDistinctIntent":true,"requireDistinctVisibleValue":true,"requireCoverageThreshold":true,"emptyPagesIndexable":false},"gates":{"task":{"required":true,"checks":["changed-search-surface"]},"wave":{"required":true,"checks":["affected-page-families","integration-seams"]},"phase":{"required":true,"checks":["phase-denominator","rendered-runtime","specialized-modes"]},"release":{"required":true,"checks":["exact-candidate","contract-conformance","current-evidence"]},"production":{"required":true,"checks":["robots","sitemap","status","redirect","canonical","rendered-html","structured-data"]},"operations":{"required":true,"checks":["declared-monitoring-signals"]}},"evidence":{"maxAgeMinutes":1440,"requireCandidateBindingForRelease":true,"requireContractHash":true,"representativeSamplesPerFamily":2},"monitoring":{"enabled":true,"signals":["sitemap","robots","canonical","noindex","status","structured-data","orphan","index-coverage","field-cwv"]}}
